{
  "artifactType": "pxs_tm_request_envelope",
  "schemaVersion": "1.0.0",
  "request_id": "pxs-tm-req-2026-03-19-010",
  "consumer_workspace": "pxs",
  "request_type": "intake",
  "canonical_contract_ref": "products/task-management/06-architecture/TDE_INTAKE_INTERFACE_CONTRACT_V1.md",
  "payload_schema_ref": "schemas/tde_intake_packet/v1.0.0.schema.json",
  "payload_schema_version": "1.0.0",
  "payload_inline": {
    "artifactType": "tde_intake_packet",
    "schemaVersion": "1.0.0",
    "intake_id": "pxs-intake-2026-03-19-010",
    "intake_class": "work",
    "source_system": "pxs",
    "source_type": "document",
    "source_reference": "pxs/docs/now-next-later.md#next",
    "submitted_at": "2026-03-19T20:28:00Z",
    "submitted_by": "Vega",
    "title": "Build first vertical slice",
    "summary": "Convert the current pxs Next priority into explicit bounded executable work rather than leaving it as a generic roadmap line.",
    "body": "The current pxs Next item 'Build first vertical slice' is meaningful but underspecified. Request Task Management intake so the work becomes explicit, reviewable, and linked to a concrete execution path.",
    "priority_hint": "high",
    "workspace_scope": "pxs",
    "product_scope": null,
    "related_entities": [
      {
        "entity_type": "artifact",
        "entity_ref": "pxs/docs/now-next-later.md",
        "relationship": "source_priority_surface"
      }
    ],
    "evidence_links": [],
    "proposed_action": "form_bounded_execution_item",
    "requested_action": "Turn 'Build first vertical slice' into one bounded execution-ready item with explicit scope and next action.",
    "success_signal": "A bounded execution item or equivalent Task Management target exists and can be reviewed by another operator."
  },
  "submitted_by": "Vega",
  "submitted_at": "2026-03-19T20:28:00Z",
  "source_reference": "pxs/docs/now-next-later.md#next",
  "note": "Semi-real pilot request grounded in an actual pxs planning artifact."
}
